<?xml version='1.0' encoding='utf-8' ?>
<!ELEMENT character (id, refresh, aspects, skills, stunts, consequences?, gear)>

  <!ELEMENT id (charname, playername, homeworld, cluster)>
    <!ELEMENT charname (#PCDATA)>
    <!ATTLIST charname nickname CDATA #IMPLIED>
    <!ELEMENT playername (#PCDATA)>
    <!ELEMENT homeworld (#PCDATA)>
    <!ELEMENT cluster (#PCDATA)>

  <!ELEMENT refresh (#PCDATA)>
    <!ATTLIST refresh base CDATA #IMPLIED>
    <!ATTLIST refresh current CDATA #IMPLIED>

  <!ELEMENT aspects (aspect*)>
    <!ELEMENT aspect (#PCDATA)>

  <!ELEMENT skills (skill*)>
    <!ELEMENT skill (#PCDATA)>
    <!ATTLIST skill name   CDATA #REQUIRED>
    <!ATTLIST skill rating CDATA #REQUIRED>

  <!ELEMENT stunts (stunt*)>
    <!ELEMENT stunt (#PCDATA)>
    <!ATTLIST stunt name CDATA #REQUIRED>

  <!ELEMENT stress (physical, mental)>
    <!ELEMENT physical (#PCDATA)>
    <!ELEMENT mental (#PCDATA)>

  <!ELEMENT consequences (consequence*)>
    <!ELEMENT consequence (#PCDATA)>
    <!ATTLIST consequence effect CDATA #IMPLIED>
    <!ATTLIST consequence severity (Mild|Moderate|Severe|Mild-Physical|Mild-Mental) #REQUIRED>

  <!ELEMENT gear (#PCDATA)>
