<?xml version="1.0" encoding="utf8"?>
<?xml-stylesheet type="text/xsl" href="../../xslt/diaspora_html.xsl"?>
<!DOCTYPE character SYSTEM "character.dtd">
<character>
  <id>
    <charname>Benny</charname>
    <playername>sample Diaspora character</playername>
    <homeworld>Old Copenhagen</homeworld>
    <cluster>TBD</cluster>
  </id>
  <refresh base="5"/>
  <aspects>
    <aspect>I hate the outdoors</aspect>
    <aspect>Natural mechanic</aspect>
    <aspect>Radiation Sickness</aspect>
    <aspect>Solution oriented</aspect>
    <aspect>Only part man</aspect>
    <aspect>Plug and play software</aspect>
    <aspect>Internal strife</aspect>
    <aspect>Sucks to be programmable</aspect>
    <aspect>Never going to have a master again</aspect>
    <aspect>Could always use another good program</aspect>
  </aspects>
  <skills>
    <skill rating="5" name="Repair"/>

    <skill rating="4" name="Bureaucracy"/>
    <skill rating="4" name="Intimidation"/>

    <skill rating="3" name="Tactics"/>
    <skill rating="3" name="Charm"/>
    <skill rating="3" name="Resolve"/>

    <skill rating="2" name="Oratory"/>
    <skill rating="2" name="Survival"/>
    <skill rating="2" name="Science"/>
    <skill rating="2" name="Vehicle"/>

    <skill rating="1" name="Agility"/>
    <skill rating="1" name="Profession: Farmer"/>
    <skill rating="1" name="Alertness"/>
    <skill rating="1" name="Profession: Teacher"/>
    <skill rating="1" name="Stamina"/>
  </skills>
  <stunts>
    <!--
         House ruling that Programmable costs double, so don't add another Stunt
         Cf. Diaspora pg 53
    -->
    <stunt name="Programmable">&#160;</stunt>
    <stunt name="Have a thing">&#160;</stunt>
  </stunts>
  <consequences>
    <consequence severity="Mild">mild one</consequence>
  </consequences>
  <gear>
    A little of this, a little of that
  </gear>
</character>
